{
  "protocolVersion": 1,
  "kind": "SHOT_CREATED",
  "shotId": "shot_0JF2LSUI5jOQR7e6H3E2LuDTqz80Qwx8",
  "sequence": 0,
  "previousRecordHash": null,
  "recordedAt": "2026-07-25T00:00:00.000Z",
  "authority": {
    "identity": {
      "role": "BUILDER",
      "method": "tohseno-local-test-v1",
      "id": "test_ZK37OkTgZ-bMwiS4GSo0GYK8taVtWFd5Vq58GfCbsxE"
    },
    "suite": "ed25519-raw-v1",
    "keyId": "ed25519_To-bSIxYGppAM3Usdf5rFSm34YGWe3vKpERYyyIOu2A",
    "publicKey": "gJjRlxb0HD5bA8B2uk5Up-UuOo5qnBKetT6dKOtW7sw"
  },
  "body": {
    "name": "Fixture Shot",
    "summary": "A deliberately public canonical protocol fixture.",
    "platform": "IOS",
    "builder": {
      "role": "BUILDER",
      "method": "tohseno-local-test-v1",
      "id": "test_ZK37OkTgZ-bMwiS4GSo0GYK8taVtWFd5Vq58GfCbsxE"
    },
    "lifecycle": "EVOLVING",
    "evolution": 0
  },
  "signature": {
    "identity": {
      "role": "BUILDER",
      "method": "tohseno-local-test-v1",
      "id": "test_ZK37OkTgZ-bMwiS4GSo0GYK8taVtWFd5Vq58GfCbsxE"
    },
    "suite": "ed25519-raw-v1",
    "keyId": "ed25519_To-bSIxYGppAM3Usdf5rFSm34YGWe3vKpERYyyIOu2A",
    "publicKey": "gJjRlxb0HD5bA8B2uk5Up-UuOo5qnBKetT6dKOtW7sw",
    "encoding": "base64url",
    "value": "2wmJGF6pfjCAaJ0f35-KjahAzr0ngP6fc-Th_drQTJdl5xft1YVqdgwIUCqlKmfH71_ntQygn_BHEl7AomTaBw"
  }
}
